{
  "$schema": "../../schemas/production.schema.json",
  "schemaVersion": 1,
  "slug": "tie-chu-mo-zhen",
  "stage": "complete",
  "createdAt": "2026-07-18T08:36:15.079Z",
  "updatedAt": "2026-07-18T15:25:05.539Z",
  "approvals": {
    "concept": {
      "status": "approved",
      "decidedAt": "2026-07-18T10:42:00.684Z",
      "note": "批准概念"
    },
    "styleAndVoice": {
      "status": "approved",
      "decidedAt": "2026-07-18T11:08:40.793Z",
      "note": "批准风格和音色"
    },
    "preview": {
      "status": "approved",
      "decidedAt": "2026-07-18T15:09:10.402Z",
      "note": "预览通过"
    },
    "publish": {
      "status": "approved",
      "decidedAt": "2026-07-18T15:25:05.539Z",
      "note": "批准发布"
    }
  },
  "workItems": [
    {
      "id": "style-sample-v2",
      "label": "生成第三幕溪边风格样片",
      "status": "completed",
      "updatedAt": "2026-07-18T10:49:07.914Z",
      "artifact": "public/projects/tie-chu-mo-zhen/assets/style/01-creek-style-sample.png",
      "note": ""
    },
    {
      "id": "motion-proof-v2",
      "label": "生成 5 秒蒙版视差与磨杵局部动作证明",
      "status": "completed",
      "updatedAt": "2026-07-18T10:49:08.230Z",
      "artifact": "dist/tie-chu-mo-zhen/style-motion-proof.mp4",
      "note": ""
    },
    {
      "id": "voice-audition-ruyayichen-v2",
      "label": "儒雅逸辰短旁白试听",
      "status": "completed",
      "updatedAt": "2026-07-18T11:04:29.804Z",
      "artifact": "public/projects/tie-chu-mo-zhen/audio/narration/audition-ruyayichen-v2.mp3",
      "note": ""
    },
    {
      "id": "background-plates-v2",
      "label": "六幕无人物基础背景",
      "status": "completed",
      "updatedAt": "2026-07-18T11:56:43.302Z",
      "artifact": null,
      "note": ""
    },
    {
      "id": "environment-layers-v2",
      "label": "十二张分层环境透明素材",
      "status": "completed",
      "updatedAt": "2026-07-18T11:56:43.534Z",
      "artifact": null,
      "note": ""
    },
    {
      "id": "character-sheets-v2",
      "label": "李白、老妇与磨杵特写角色图板",
      "status": "completed",
      "updatedAt": "2026-07-18T11:56:43.737Z",
      "artifact": null,
      "note": ""
    },
    {
      "id": "narration-scenes-v2",
      "label": "六段儒雅逸辰正式旁白",
      "status": "completed",
      "updatedAt": "2026-07-18T11:17:08.218Z",
      "artifact": "projects/tie-chu-mo-zhen/assets-manifest.json",
      "note": ""
    },
    {
      "id": "revision-granny-grinding",
      "label": "修正老妇磨杵全身动作",
      "status": "completed",
      "updatedAt": "2026-07-18T14:45:08.913Z",
      "artifact": "public/projects/tie-chu-mo-zhen/assets/characters/alpha/granny-grinding-a.png",
      "note": ""
    },
    {
      "id": "revision-grind-close",
      "label": "修正铁杵端部研磨特写",
      "status": "completed",
      "updatedAt": "2026-07-18T14:45:09.075Z",
      "artifact": "public/projects/tie-chu-mo-zhen/assets/characters/alpha/grind-hands-a.png",
      "note": ""
    },
    {
      "id": "revision-granny-contact",
      "label": "强化第三幕铁杵单端接触磨石",
      "status": "completed",
      "updatedAt": "2026-07-18T14:59:40.267Z",
      "artifact": "public/projects/tie-chu-mo-zhen/assets/characters/alpha/granny-grinding-a.png",
      "note": ""
    }
  ],
  "artifacts": {
    "brief": "projects/tie-chu-mo-zhen/brief.md",
    "project": "projects/tie-chu-mo-zhen/project.json",
    "prompts": "projects/tie-chu-mo-zhen/prompts.json",
    "review": "projects/tie-chu-mo-zhen/review.md",
    "validationReport": "dist/tie-chu-mo-zhen/validation-report.json",
    "preview": "dist/tie-chu-mo-zhen/preview.mp4",
    "final": "dist/tie-chu-mo-zhen/final.mp4",
    "report": "dist/tie-chu-mo-zhen/report.json",
    "contactSheet": "dist/tie-chu-mo-zhen/contact-sheet.jpg"
  },
  "history": [
    {
      "at": "2026-07-18T08:36:15.079Z",
      "action": "project-created",
      "stage": "capability-review",
      "note": ""
    },
    {
      "at": "2026-07-18T10:31:32.662Z",
      "action": "capabilities-ready",
      "stage": "brief",
      "note": "用户确认 host-text、gpt-image、chatcut-voice"
    },
    {
      "at": "2026-07-18T10:34:30.875Z",
      "action": "brief-ready",
      "stage": "concept-review",
      "note": "用户未指定时长和幕数；Skill 根据六个故事转折推导为 78 秒、6 幕"
    },
    {
      "at": "2026-07-18T10:42:00.684Z",
      "action": "approve-concept",
      "stage": "style-review",
      "note": "批准概念"
    },
    {
      "at": "2026-07-18T10:43:00.438Z",
      "action": "work-item-in-progress",
      "stage": "style-review",
      "note": "style-sample-v2"
    },
    {
      "at": "2026-07-18T10:49:07.914Z",
      "action": "work-item-completed",
      "stage": "style-review",
      "note": "style-sample-v2"
    },
    {
      "at": "2026-07-18T10:49:08.230Z",
      "action": "work-item-completed",
      "stage": "style-review",
      "note": "motion-proof-v2"
    },
    {
      "at": "2026-07-18T11:00:50.738Z",
      "action": "work-item-in-progress",
      "stage": "style-review",
      "note": "voice-audition-ruyayichen-v2"
    },
    {
      "at": "2026-07-18T11:04:29.804Z",
      "action": "work-item-completed",
      "stage": "style-review",
      "note": "voice-audition-ruyayichen-v2"
    },
    {
      "at": "2026-07-18T11:08:40.793Z",
      "action": "approve-style-voice",
      "stage": "asset-production",
      "note": "批准风格和音色"
    },
    {
      "at": "2026-07-18T11:14:52.352Z",
      "action": "work-item-in-progress",
      "stage": "asset-production",
      "note": "background-plates-v2"
    },
    {
      "at": "2026-07-18T11:14:52.561Z",
      "action": "work-item-in-progress",
      "stage": "asset-production",
      "note": "environment-layers-v2"
    },
    {
      "at": "2026-07-18T11:14:52.763Z",
      "action": "work-item-in-progress",
      "stage": "asset-production",
      "note": "character-sheets-v2"
    },
    {
      "at": "2026-07-18T11:14:52.977Z",
      "action": "work-item-in-progress",
      "stage": "asset-production",
      "note": "narration-scenes-v2"
    },
    {
      "at": "2026-07-18T11:17:08.218Z",
      "action": "work-item-completed",
      "stage": "asset-production",
      "note": "narration-scenes-v2"
    },
    {
      "at": "2026-07-18T11:56:43.302Z",
      "action": "work-item-completed",
      "stage": "asset-production",
      "note": "background-plates-v2"
    },
    {
      "at": "2026-07-18T11:56:43.534Z",
      "action": "work-item-completed",
      "stage": "asset-production",
      "note": "environment-layers-v2"
    },
    {
      "at": "2026-07-18T11:56:43.737Z",
      "action": "work-item-completed",
      "stage": "asset-production",
      "note": "character-sheets-v2"
    },
    {
      "at": "2026-07-18T12:03:41.357Z",
      "action": "assets-ready",
      "stage": "preview",
      "note": ""
    },
    {
      "at": "2026-07-18T12:15:56.925Z",
      "action": "preview-rendered",
      "stage": "human-review",
      "note": "dist/tie-chu-mo-zhen/preview.mp4"
    },
    {
      "at": "2026-07-18T14:31:00.977Z",
      "action": "request-preview-revision",
      "stage": "asset-production",
      "note": "用户指出磨杵动作不准确：应握住铁杵，只让一端在磨石上沿轴向来回摩擦并逐渐磨尖，不应横放滚动整根铁棒"
    },
    {
      "at": "2026-07-18T14:31:01.131Z",
      "action": "work-item-in-progress",
      "stage": "asset-production",
      "note": "revision-granny-grinding"
    },
    {
      "at": "2026-07-18T14:31:01.281Z",
      "action": "work-item-in-progress",
      "stage": "asset-production",
      "note": "revision-grind-close"
    },
    {
      "at": "2026-07-18T14:45:08.913Z",
      "action": "work-item-completed",
      "stage": "asset-production",
      "note": "revision-granny-grinding"
    },
    {
      "at": "2026-07-18T14:45:09.075Z",
      "action": "work-item-completed",
      "stage": "asset-production",
      "note": "revision-grind-close"
    },
    {
      "at": "2026-07-18T14:45:10.201Z",
      "action": "assets-ready",
      "stage": "preview",
      "note": ""
    },
    {
      "at": "2026-07-18T14:48:07.370Z",
      "action": "preview-rendered",
      "stage": "human-review",
      "note": "dist/tie-chu-mo-zhen/preview.mp4"
    },
    {
      "at": "2026-07-18T14:51:43.253Z",
      "action": "request-preview-revision",
      "stage": "asset-production",
      "note": "落实同一条用户反馈时，连续帧复核发现第三幕接触石面不够明确；补强单端落在磨石上的可读性"
    },
    {
      "at": "2026-07-18T14:51:43.631Z",
      "action": "work-item-in-progress",
      "stage": "asset-production",
      "note": "revision-granny-contact"
    },
    {
      "at": "2026-07-18T14:59:40.267Z",
      "action": "work-item-completed",
      "stage": "asset-production",
      "note": "revision-granny-contact"
    },
    {
      "at": "2026-07-18T14:59:41.451Z",
      "action": "assets-ready",
      "stage": "preview",
      "note": ""
    },
    {
      "at": "2026-07-18T15:02:45.276Z",
      "action": "preview-rendered",
      "stage": "human-review",
      "note": "dist/tie-chu-mo-zhen/preview.mp4"
    },
    {
      "at": "2026-07-18T15:09:10.402Z",
      "action": "approve-preview",
      "stage": "final-render",
      "note": "预览通过"
    },
    {
      "at": "2026-07-18T15:22:45.761Z",
      "action": "final-rendered",
      "stage": "publish-approval",
      "note": "dist/tie-chu-mo-zhen/final.mp4"
    },
    {
      "at": "2026-07-18T15:25:05.539Z",
      "action": "approve-publish",
      "stage": "complete",
      "note": "批准发布"
    }
  ]
}
